{
  "audit_id": "3c9f2a1e-7d45-4f8b-9c2a-8a1b2c3d4e5f",
  "timestamp": "2025-10-15T11:55:00Z",
  "actor": "ai-ops-agent-01",
  "action": "credential_checkout",
  "workflow_step": "SEC-001",
  "jira_reference": {
    "cr_id": "CR-2025-1042",
    "approver_role": "Change Manager",
    "budget_tokens": 500,
    "controls": ["SEC-001"]
  },
  "inputs": {
    "secret_name": "prod/db/password",
    "purpose": "database_connection"
  },
  "outputs": {
    "lease_id": "lease-xyz-123",
    "expiry": "2025-10-15T12:05:00Z"
  },
  "policy_controls_checked": ["SEC-001"],
  "compliance_result": "pass",
  "evidence_hash": "sha256:abcd1234...",
  "auditor_agent": "AUD-001"
}
