{
  "audit_id": "4d2e1f9a-8c77-4a9b-9b3e-7f6a5d4c3b2a",
  "timestamp": "2025-10-15T11:57:00Z",
  "actor": "ai-ops-agent-01",
  "action": "credential_checkin",
  "workflow_step": "SEC-001",
  "jira_reference": {
    "cr_id": "CR-2025-1042",
    "approver_role": "Change Manager",
    "budget_tokens": 500,
    "controls": ["SEC-001"]
  },
  "inputs": {
    "lease_id": "lease-xyz-123"
  },
  "outputs": {
    "status": "released"
  },
  "policy_controls_checked": ["SEC-001"],
  "compliance_result": "pass",
  "evidence_hash": "sha256:efgh5678...",
  "auditor_agent": "AUD-001"
}
